{
  "contract_version": "0.1.0",
  "preference_id": "prf_syn_style_a",
  "subject_id": "sub_syn_guest_a",
  "kind": "style",
  "value_text": "قصّة قصيرة من الجوانب",
  "source": "customer_typed",
  "provenance": "approved_preference",
  "version": 1,
  "created_at": "2026-09-14T10:10:00Z",
  "revoked_at": null
}
